{
  "schema_version": "1.0",
  "receipt_type": "RING8_AGGREGATE_PROMOTION_CLOSURE",
  "ring": "R8-L",
  "version": "vTemporal.41.0",
  "implementation_identity": "v41 Complete",
  "approved_candidate_commit": "2d1013304c6c13efd08fc3a9d7aed7804642cde2",
  "r8h_commit": "62bd3c9f54d46034181c9d94a443757a857423c1",
  "r8i_commit": "e4ce260198fa962f9915f1af7f227454856a96ed",
  "r8j_commit": "676e03e98b94f0461596f13605195242ba7290fc",
  "r8k_commit": "be3e098fd4e50ed152a8f3060c6ba310aa096510",
  "human_gate_decision": "APPROVE",
  "human_gate_authorization": "GRANTED",
  "r8f_disposition": "SKIPPED_BY_HUMAN_DIRECTION",
  "promotion_executed": true,
  "candidate_preserved": true,
  "fast_forward_promotion": true,
  "merge_commit_created": false,
  "promotion_state": "CANONICAL",
  "canonical": true,
  "canonical_branch": "main",
  "post_promotion_integrity": "VERIFIED",
  "post_promotion_fresh_reader": "VALIDATED",
  "promotion_completion": "RECORDED",
  "authority_state": "NONE",
  "human_gate_state": "ACTIVE",
  "external_runtime": "DISABLED",
  "external_action": "DISABLED",
  "system_population": "DISALLOWED",
  "disposition": "RING8_CLOSED_CANONICAL"
}
